{
  "city": "Tallahassee",
  "state": "Florida",
  "stateCode": "FL",
  "slug": "tallahassee",
  "county": "Leon County",
  "population": 196169,
  "availableServices": [
    "septic-tank-pumping",
    "septic-tank-cleaning",
    "septic-tank-inspection",
    "real-estate-septic-inspections",
    "septic-tank-replacement",
    "emergency-septic-services",
    "drain-field-replacement",
    "drain-field-installation",
    "new-septic-system-installation",
    "septic-tank-riser-installation",
    "septic-baffle-replacement",
    "septic-tank-location-service",
    "septic-tank-camera-inspections",
    "lift-station-monitoring-and-service",
    "septic-system-maintenance-plans"
  ],
  "metaDescription": "Find trusted septic pros in Tallahassee, FL. Get free quotes for pumping, inspection, repair, drainfield work, and emergency service. Local experts."
}

