{
  "city": "Tampa",
  "state": "Florida",
  "stateCode": "FL",
  "slug": "tampa",
  "county": "Hillsborough County",
  "population": 387050,
  "availableServices": [
    "septic-tank-pumping",
    "septic-tank-cleaning",
    "septic-tank-inspection",
    "real-estate-septic-inspections",
    "septic-tank-replacement",
    "emergency-septic-services",
    "drain-field-replacement",
    "drain-field-installation",
    "new-septic-system-installation",
    "septic-tank-riser-installation",
    "septic-baffle-replacement",
    "septic-tank-location-service",
    "septic-tank-camera-inspections",
    "lift-station-monitoring-and-service",
    "septic-system-maintenance-plans"
  ],
  "localInsights": "## Septic Systems in Tampa\n\nTampa's sandy soil and proximity to the Gulf of Mexico create specific considerations for septic system installation and maintenance.\n\n### Local Regulations\n\nHillsborough County follows Florida Department of Health regulations for septic systems. Permits are required for installation, repair, and replacement. Regular inspections help ensure compliance.\n\n### Climate Considerations\n\nTampa's hot, humid climate and frequent afternoon thunderstorms can affect system performance. High groundwater levels during the wet season (Juneâ€“September) can stress drainfields.",
  "metaDescription": "Find trusted septic pros in Tampa, FL. Get free quotes for pumping, inspection, repair, drainfield work, and emergency service. Local experts."
}

