{
  "city": "Jacksonville",
  "state": "Florida",
  "stateCode": "FL",
  "slug": "jacksonville",
  "county": "Duval County",
  "population": 949611,
  "availableServices": [
    "septic-tank-pumping",
    "septic-tank-cleaning",
    "septic-tank-inspection",
    "real-estate-septic-inspections",
    "septic-tank-replacement",
    "emergency-septic-services",
    "drain-field-replacement",
    "drain-field-installation",
    "new-septic-system-installation",
    "septic-tank-riser-installation",
    "septic-baffle-replacement",
    "septic-tank-location-service",
    "septic-tank-camera-inspections",
    "lift-station-monitoring-and-service",
    "septic-system-maintenance-plans"
  ],
  "localInsights": "## Septic Systems in Jacksonville\n\nJacksonville's size and diverse terrain mean septic system requirements vary by location. Coastal areas face different challenges than inland properties.",
  "metaDescription": "Find trusted septic pros in Jacksonville, FL. Get free quotes for pumping, inspection, repair, drainfield work, and emergency service. Local experts."
}

