{
  "city": "Orlando",
  "state": "Florida",
  "stateCode": "FL",
  "slug": "orlando",
  "county": "Orange County",
  "population": 307573,
  "availableServices": [
    "septic-tank-pumping",
    "septic-tank-cleaning",
    "septic-inspection",
    "real-estate-septic-inspection",
    "septic-tank-repair",
    "emergency-pumping",
    "drainfield-repair",
    "drainfield-replacement",
    "septic-installation",
    "riser-installation",
    "baffle-replacement",
    "septic-tank-locating",
    "camera-inspection",
    "lift-station-service",
    "septic-system-maintenance"
  ],
  "localInsights": "## Septic Systems in Orlando\n\nOrlando's flat terrain and sandy soil provide generally good conditions for septic systems, though high water tables in some areas require careful planning.\n\n### Local Regulations\n\nOrange County Health Department regulates septic systems. Proper permits and inspections are required for all major work.",
  "metaDescription": "Find trusted septic pros in Orlando, FL. Get free quotes for pumping, inspection, repair, drainfield work, and emergency service. Local experts."
}

